Type,Link,Anchor,Snippet
ad,https://www.gettaxi.com/book,GetTaxi - Book a Taxi Online in Seconds,"Book your taxi ride in seconds. Fast, reliable service with professional drivers. Available 24/7 in major cities. Download the app now."
ad,https://www.uber.com/ride,Uber - Get a Ride in Minutes,"Request a ride with Uber. Affordable prices, safe rides, and available in hundreds of cities. Sign up and get your first ride free."
ad,https://www.bolt.eu/en/ride,Bolt - Fast and Affordable Taxi,"Get a taxi with Bolt. Enjoy fast pickups, professional drivers, and the best prices. Available in 45+ countries. Download the app."
organic,https://gett.com/uk/,Gett | Ground Transportation Management Platform,"Gett is a global on-demand mobility company offering corporate ground transportation management. Book rides for business travel, airport transfers and daily commutes."
organic,https://www.lyft.com/,Lyft - A Ride Whenever You Need One,"Request a Lyft ride in seconds. Compare prices and get picked up by a nearby driver. Safe, affordable rides for everyone. Available in the US and Canada."
organic,https://www.freenow.com/,FREE NOW - The Mobility Super App,"FREE NOW (formerly mytaxi) is Europe's largest taxi app. Book a taxi, private driver, or e-scooter in 150+ cities across Europe."
organic,https://www.grab.com/sg/transport/,Grab - Southeast Asia's #1 Ride-Hailing App,Download Grab app for the fastest way to book a taxi or private car. Available across Southeast Asia with millions of daily rides. Safe and reliable.
organic,https://www.curb.com/,Curb - The Taxi App,"Curb connects riders with safe, licensed taxi and for-hire vehicle drivers. Available in 65+ US cities. Pay with card directly through the app."
organic,https://www.cabify.com/en,Cabify - Book a Ride with Professional Drivers,Cabify offers professional drivers and comfortable vehicles. Book your ride in Spain and Latin America. Corporate accounts available for businesses.
organic,https://www.didi.com/en,"DiDi - Your Ride, Your Way","DiDi provides ride-hailing services in more than 15 countries. Safe, affordable and convenient transportation with multiple ride options."
organic,https://www.ola.com/,Ola Cabs - India's Most Popular Ride Service,"Book Ola cabs for safe and reliable rides across India. Multiple ride options including micro, mini, prime and SUV. Over 1.5 million drivers."
organic,https://www.wikihow.com/Get-a-Taxi,How to Get a Taxi: 8 Steps (with Pictures) - wikiHow,"Learn how to hail a taxi on the street, call a cab company, or use a ride-sharing app. Tips for getting a taxi in different cities and countries."
organic,https://en.wikipedia.org/wiki/Taxicab,Taxicab - Wikipedia,"A taxicab, also known as a taxi or a cab, is a type of vehicle for hire with a driver. Used by a single passenger or small group for a non-shared ride."
